{
  "$schema": "https://json-schema.org/draft/2020-12/schema",
  "$id": "https://schemas.nebula-observability.io/rum/rutp/v1/batch.schema.json",
  "type": "object",
  "required": ["protocol_version", "schema_url", "otel_schema_url", "batch_id", "project_id", "sent_time_unix_nano", "resource", "scope", "clock", "records"],
  "properties": {
    "protocol_version": {
      "type": "string",
      "pattern": "^1\\.(0|[1-9][0-9]*)\\.(0|[1-9][0-9]*)(?:-[0-9A-Za-z-]+(?:\\.[0-9A-Za-z-]+)*)?(?:\\+[0-9A-Za-z-]+(?:\\.[0-9A-Za-z-]+)*)?$"
    },
    "schema_url": { "type": "string", "format": "uri" },
    "otel_schema_url": { "type": "string", "format": "uri" },
    "batch_id": { "$ref": "#/$defs/id" },
    "project_id": {
      "type": "string",
      "minLength": 1,
      "description": "Client-declared assertion; receivers must compare it with the server-side authenticated principal binding and must not route from it."
    },
    "sent_time_unix_nano": { "$ref": "#/$defs/uint64" },
    "resource": {
      "type": "object",
      "required": ["attributes"],
      "properties": {
        "attributes": {
          "type": "object",
          "required": ["service.namespace", "service.name", "service.version", "service.instance.id", "deployment.environment.name", "telemetry.sdk.name", "telemetry.sdk.version", "app.installation.id"],
          "additionalProperties": true
        }
      },
      "additionalProperties": true
    },
    "scope": {
      "type": "object",
      "required": ["name", "version"],
      "properties": {
        "name": { "type": "string", "minLength": 1 },
        "version": { "type": "string", "minLength": 1 },
        "attributes": { "$ref": "#/$defs/attributes" }
      },
      "additionalProperties": true
    },
    "clock": {
      "type": "object",
      "required": ["wall_time_unix_nano", "monotonic_time_nano", "offset_millis", "uncertainty_millis"],
      "properties": {
        "wall_time_unix_nano": { "$ref": "#/$defs/uint64" },
        "monotonic_time_nano": { "$ref": "#/$defs/uint64" },
        "offset_millis": { "type": "integer" },
        "uncertainty_millis": { "type": "integer", "minimum": 0 }
      },
      "additionalProperties": true
    },
    "records": { "type": "array", "minItems": 1, "items": { "$ref": "#/$defs/record" } },
    "attachments": { "type": "array", "items": { "type": "object" } },
    "diagnostics": { "type": "object" }
  },
  "additionalProperties": true,
  "$defs": {
    "id": { "type": "string", "minLength": 8, "maxLength": 128 },
    "uint64": { "oneOf": [{ "type": "integer", "minimum": 0 }, { "type": "string", "pattern": "^[0-9]+$" }] },
    "attributes": { "type": "object", "additionalProperties": true },
    "context": {
      "type": "object",
      "required": ["session_id", "document_id", "view_id"],
      "properties": {
        "trace_id": { "type": "string", "pattern": "^[0-9a-f]{32}$" },
        "span_id": { "type": "string", "pattern": "^[0-9a-f]{16}$" },
        "parent_span_id": { "type": "string", "pattern": "^[0-9a-f]{16}$" },
        "trace_flags": { "type": "integer", "minimum": 0, "maximum": 255 },
        "trace_state": { "type": "string" },
        "session_id": { "$ref": "#/$defs/id" },
        "document_id": { "$ref": "#/$defs/id" },
        "view_id": { "$ref": "#/$defs/id" },
        "navigation_id": { "$ref": "#/$defs/id" },
        "action_id": { "$ref": "#/$defs/id" },
        "replay_id": { "$ref": "#/$defs/id" },
        "attributes": { "$ref": "#/$defs/attributes" }
      },
      "additionalProperties": true
    },
    "record": {
      "type": "object",
      "required": ["record_id", "time_unix_nano", "observed_time_unix_nano", "monotonic_time_nano", "source_id", "sequence", "priority", "context", "signal"],
      "properties": {
        "record_id": { "$ref": "#/$defs/id" },
        "time_unix_nano": { "$ref": "#/$defs/uint64" },
        "observed_time_unix_nano": { "$ref": "#/$defs/uint64" },
        "monotonic_time_nano": { "$ref": "#/$defs/uint64" },
        "source_id": { "type": "string", "minLength": 1 },
        "sequence": { "type": "integer", "minimum": 0 },
        "priority": { "enum": ["critical", "high", "normal", "low"] },
        "context": { "$ref": "#/$defs/context" },
        "signal": {
          "oneOf": [
            { "$ref": "#/$defs/span" },
            { "$ref": "#/$defs/event" },
            { "$ref": "#/$defs/metric" },
            { "$ref": "#/$defs/diagnostic" },
            { "$ref": "#/$defs/replay" }
          ]
        }
      },
      "additionalProperties": true
    },
    "span": {
      "type": "object",
      "required": ["type", "name", "kind", "start_time_unix_nano", "end_time_unix_nano", "attributes"],
      "properties": {
        "type": { "const": "span" },
        "name": { "type": "string", "minLength": 1 },
        "kind": { "enum": ["internal", "client", "server", "producer", "consumer"] },
        "start_time_unix_nano": { "$ref": "#/$defs/uint64" },
        "end_time_unix_nano": { "$ref": "#/$defs/uint64" },
        "attributes": { "$ref": "#/$defs/attributes" },
        "status_code": { "enum": ["unset", "ok", "error"] },
        "status_message": { "type": "string" },
        "links": { "type": "array", "items": { "type": "object" } }
      },
      "additionalProperties": true
    },
    "event": {
      "type": "object",
      "required": ["type", "name", "severity_number", "attributes"],
      "properties": {
        "type": { "const": "event" },
        "name": { "type": "string", "pattern": "^[a-z][a-z0-9_.]*$" },
        "severity_number": { "type": "integer", "minimum": 0, "maximum": 24 },
        "attributes": { "$ref": "#/$defs/attributes" },
        "display_message": { "type": "string" },
        "stack": {
          "type": "object",
          "required": ["type", "frames"],
          "properties": {
            "type": { "type": "string", "minLength": 1, "maxLength": 256 },
            "value": { "type": "string", "maxLength": 4096 },
            "frames": {
              "type": "array",
              "maxItems": 64,
              "items": {
                "type": "object",
                "required": ["filename"],
                "properties": {
                  "function": { "type": "string", "maxLength": 256 },
                  "filename": { "type": "string", "minLength": 1, "maxLength": 1024 },
                  "line": { "type": "integer", "minimum": 1 },
                  "column": { "type": "integer", "minimum": 1 },
                  "in_app": { "type": "boolean" }
                },
                "additionalProperties": true
              }
            }
          },
          "additionalProperties": true
        },
        "breadcrumbs": {
          "type": "array",
          "maxItems": 32,
          "items": {
            "type": "object",
            "required": ["time_unix_nano", "category", "message"],
            "properties": {
              "time_unix_nano": { "$ref": "#/$defs/uint64" },
              "category": {
                "enum": ["navigation", "http", "ui", "error", "custom"]
              },
              "message": { "type": "string", "minLength": 1, "maxLength": 1024 },
              "attributes": { "$ref": "#/$defs/attributes" }
            },
            "additionalProperties": true
          }
        }
      },
      "additionalProperties": true
    },
    "metric": {
      "type": "object",
      "required": ["type", "name", "kind", "value", "attributes"],
      "properties": {
        "type": { "const": "metric" },
        "name": { "type": "string" },
        "kind": { "enum": ["gauge", "counter", "histogram"] },
        "value": {},
        "attributes": { "$ref": "#/$defs/attributes" }
      },
      "additionalProperties": true
    },
    "diagnostic": {
      "type": "object",
      "required": ["type", "code", "count"],
      "properties": {
        "type": { "const": "diagnostic" },
        "code": { "type": "string" },
        "message": { "type": "string" },
        "count": { "type": "integer", "minimum": 1 },
        "attributes": { "$ref": "#/$defs/attributes" }
      },
      "additionalProperties": true
    },
    "replay": {
      "type": "object",
      "required": ["type", "replay_id", "segment_id", "codec", "complete"],
      "properties": {
        "type": { "const": "replay" },
        "replay_id": { "$ref": "#/$defs/id" },
        "segment_id": { "$ref": "#/$defs/id" },
        "codec": { "type": "string" },
        "complete": { "type": "boolean" }
      },
      "additionalProperties": true
    }
  }
}
